{
  "schema_version": "1.0",
  "document_type": "publication_receipt",
  "manifest_sha256": "e6affd0a4f8fc23e7a14e8a98807df4269a0bf3c5cfc84f23953b754411717b7",
  "github_state": "published",
  "artifacts": [
    {
      "reference": {
        "repository": "syuhei0519/ai-development-system",
        "commit": "9f4264d43b8de7db27792e63fd6e91470adefc4f",
        "path": "research/issue-completion/handoff.json",
        "size": 8152,
        "sha256": "f2a2bc68c696cdf691786bee798006fe24a2c0bcd1e3d38e44d29a57ab5c76bf"
      },
      "representation": "edited_derivative",
      "format": "handoff-v2",
      "public_classification": "public_safe",
      "source_alias": "PUBLIC-AGGREGATION-DESIGN"
    },
    {
      "reference": {
        "repository": "syuhei0519/ai-development-system",
        "commit": "9f4264d43b8de7db27792e63fd6e91470adefc4f",
        "path": "research/issue-completion/report.md",
        "size": 30484,
        "sha256": "059b4eb96e142e1038072ff3d8a635b7f03bcb751b67874dafbabea1d677bff7"
      },
      "representation": "edited_derivative",
      "format": "text",
      "public_classification": "public_safe",
      "source_alias": "PUBLIC-AGGREGATION-DESIGN"
    },
    {
      "reference": {
        "repository": "syuhei0519/ai-development-system",
        "commit": "9f4264d43b8de7db27792e63fd6e91470adefc4f",
        "path": "research/issue-completion/requirements.md",
        "size": 1897,
        "sha256": "6b811a1f49c4825fcab10636251033f1dfcb4c1809d8f356077ce536ae809cbf"
      },
      "representation": "edited_derivative",
      "format": "text",
      "public_classification": "public_safe",
      "source_alias": "PUBLIC-AGGREGATION-DESIGN"
    },
    {
      "reference": {
        "repository": "syuhei0519/ai-development-system",
        "commit": "9f4264d43b8de7db27792e63fd6e91470adefc4f",
        "path": "research/issue-completion/sources.md",
        "size": 5693,
        "sha256": "874c764d999fffc04d30459310818799dc42ff33430998284dd1ae6ef1723988"
      },
      "representation": "edited_derivative",
      "format": "text",
      "public_classification": "public_safe",
      "source_alias": "PUBLIC-AGGREGATION-DESIGN"
    },
    {
      "reference": {
        "repository": "syuhei0519/ai-development-system",
        "commit": "9f4264d43b8de7db27792e63fd6e91470adefc4f",
        "path": "research/issue-completion/validation-summary.md",
        "size": 2385,
        "sha256": "3d542dc42a6925d8c5cac63bbcf78f8c49e35578af763e8f86c345955c4df5be"
      },
      "representation": "edited_derivative",
      "format": "text",
      "public_classification": "public_safe",
      "source_alias": "PUBLIC-AGGREGATION-DESIGN"
    }
  ],
  "observation": "Fresh isolated Git fetch verified all five fixed-commit payloads by full raw-byte size and SHA-256, with Handoff v2 artifact bindings. Observed at 2026-10-11T03:02:40.504959+00:00. Publication does not grant Consumer use or product operation authority."
}
